title,num_citations,year,excerpt,url,url_pdf,indicator,key_words
Model predictive control of a thermally activated building system to improve energy management of an experimental building: Part II-Potential of predictive …,39,2018,… This work proposes to use a Model Predictive Control (MPC) for one TABS in particular: a floor heating system (FHS) of an … of a FHS connected to an air/water heat pump. The …,https://www.sciencedirect.com/science/article/pii/S0378778818311460,,0,"heat pump, thermal energy storage, model predictive control"
Model predictive control for demand response of domestic hot water preparation in ultra-low temperature district heating systems,76,2017,… is therefore often proposed to raise the temperature. This paper investigates how this heat pump can be utilized for price based demand response to induce peak reductions and energy …,https://www.sciencedirect.com/science/article/pii/S0378778817312896,,0,"heat pump, thermal energy storage, model predictive control"
Model predictive control of a thermally activated building system to improve energy management of an experimental building: Part I—Modeling and …,55,2018,"… setpoint changes because of their thermal inertia. A model predictive control (MPC) allows the … floors, various heating or cooling systems and for energy storage (Table 1). Madsen and …",https://www.sciencedirect.com/science/article/pii/S0378778818311435,,0,"heat pump, thermal energy storage, model predictive control"
An active control strategy for district heating networks and the effect of different thermal energy storage configurations,48,2018,"… the use of the thermal mass of the buildings as storage capacity. Besides the development of the control algorithms based on model predictive control, a simulation model of the network …",https://www.sciencedirect.com/science/article/pii/S0378778817303961,,0,"heat pump, thermal energy storage, model predictive control"
A model-based optimal control strategy for ground source heat pump systems with integrated solar photovoltaic thermal collectors,69,2018,"… For instance, Sundbrandt [5] developed a model predictive control (MPC) … thermal energy stored in the water tank can be used for ground recharge, space heating and DHW heating…",https://www.sciencedirect.com/science/article/pii/S0306261918310511,,0,"heat pump, thermal energy storage, model predictive control"
Potential of predictive control for improvement of seasonal coefficient of performance of air source heat pump in Central European climate zone,43,2018,… Better prediction of building's energy losses is also reported to … models were developed using Stochastic Model Predictive … supply and ensure accumulation of thermal energy in the …,https://www.sciencedirect.com/science/article/pii/S0360544218307448,,0,"heat pump, thermal energy storage, model predictive control"
… of thermal energy storage and heat pump parametrization for demand-side-management in a nearly-zero-energy-building using model predictive control,58,2020,"… energy … heat storage sizes and heat pump powers on cost savings and shifting potential, focussing on the Luxembourgish context, when variable electricity prices based on the electricity …",https://www.sciencedirect.com/science/article/pii/S0378778820313086,,0,"heat pump, thermal energy storage, model predictive control"
Model predictive control applied to a heating system with PV panels and thermal energy storage,51,2020,… annual energy costs of the heating system of … heat pump coupled to a thermal energy storage unit and photovoltaic panels. The results show the potential of the model predictive control …,https://www.sciencedirect.com/science/article/pii/S0360544220303364,,0,"heat pump, thermal energy storage, model predictive control"
Systematic review on model predictive control strategies applied to active thermal energy storage systems,59,2021,"… of model predictive control strategies to active thermal energy storage systems. To date, … These tested the performance of two heating systems based on heat pumps, following the …",https://www.sciencedirect.com/science/article/pii/S1364032121006705,,0,"heat pump, thermal energy storage, model predictive control"
Model predictive control of a hybrid heat pump system and impact of the prediction horizon on cost-saving potential and optimal storage capacity,76,2019,"… 1 in black), without thermal energy storage, a control unit establishes which generator should be activated to meet the load, on the basis of minimum-cost criteria and the operating …",https://www.sciencedirect.com/science/article/pii/S1359431118323482,,0,"heat pump, thermal energy storage, model predictive control"
Model-based predictive control to minimize primary energy use in a solar district heating system with seasonal thermal energy storage,56,2021,"… application of predictive control to reduce the environmental footprint of a district heating network, … as usual, optimal reactive control and model predictive control strategies in 2017–18. …",https://www.sciencedirect.com/science/article/pii/S0306261921003366,,0,"heat pump, thermal energy storage, model predictive control"
Model predictive control of building energy systems with thermal energy storage in response to occupancy variations and time-variant electricity prices,53,2020,… reduce energy usage and greenhouse gas emissions. This study aims to validate the feasibility of a model predictive control (… to operation of heat pump system without TES system [10]. …,https://www.sciencedirect.com/science/article/pii/S0378778820302875,,0,"heat pump, thermal energy storage, model predictive control"
Model predictive control for thermal energy storage assisted large central cooling systems,29,2019,… to use thermal energy storage (TES) to enhance energy efficiency of extremely large constant speed chillers. A new model predictive control method is proposed to control the charging/…,https://www.sciencedirect.com/science/article/pii/S0360544219308175,,0,"heat pump, thermal energy storage, model predictive control"
Thermal energy storage sizing for industrial waste-heat utilization in district heating: A model predictive control approach,34,2021,… problem of sizing TES in heating plants utilizing a varying waste-heat source. To this … model predictive control approach that accounts for the dynamics and optimal control of the heating …,https://www.sciencedirect.com/science/article/pii/S0360544221014481,,0,"heat pump, thermal energy storage, model predictive control"
Bibliometric analysis of smart control applications in thermal energy storage systems. A model predictive control approach,54,2020,"… query string “thermal energy storage AND model predictive control” for the … heat pumps, its application in district heating, and a wider analysis of the performance in conventional heating …",https://www.sciencedirect.com/science/article/pii/S2352152X20315413,,0,"heat pump, thermal energy storage, model predictive control"
Management of a district heating network using model predictive control with and without thermal storage,22,2021,"… model predictive control strategy was formulated as a MILP optimization problem to schedule the heat supply of the cogeneration plants, heat pump … additional thermal energy storage is …",https://link.springer.com/article/10.1007/s11081-021-09644-w,,0,"heat pump, thermal energy storage, model predictive control"
Exergy-based model predictive control for design and control of a seasonal thermal energy storage system,11,2019,"… model predictive control (MPC) scheme. In this regard, we develop an appropriate model for the … is not endowed with a heat pump and only receives energy from a large solar collector. …",https://iopscience.iop.org/article/10.1088/1742-6596/1343/1/012066/meta,,0,"heat pump, thermal energy storage, model predictive control"
Experimental short-term investigation of model predictive heat pump control in residential buildings,35,2019,… The thermal energy storage was fully mixed and cooled down to 21C. Both heat pumps were … The optimization objective of the model predictive controller was to minimize the heat pump …,https://www.sciencedirect.com/science/article/pii/S0378778819320419,,0,"heat pump, thermal energy storage, model predictive control"
Mixed-integer model predictive control of variable-speed heat pumps,41,2019,… RHC viability increases when thermal energy storage (TES) is added to the heat pump … approach by applying model predictive control (MPC) to a realistic heat pump control problem. …,https://www.sciencedirect.com/science/article/pii/S0378778819302609,,0,"heat pump, thermal energy storage, model predictive control"
The operation of district heating with heat pumps and thermal energy storage in a zero-emission scenario,31,2021,… This paper presents the implementation of a model predictive control (MPC) algorithm to simulate the operation of DH with large scale heat pumps in a decarbonised energy system. …,https://www.sciencedirect.com/science/article/pii/S2352484721007617,,0,"heat pump, thermal energy storage, model predictive control"
Model predictive control of a high efficiency solar thermal cooling system with thermal storage,25,2019,… model predictive control (MPC) approach for controlling a high efficiency absorption chiller-based solar cooling system with thermal energy storage… exists on models used for heat pump …,https://www.sciencedirect.com/science/article/pii/S0378778818332018,,0,"heat pump, thermal energy storage, model predictive control"
Fifth-generation district heating and cooling substations: Demand response with artificial neural network-based model predictive control,49,2020,"… (DR) strategy and exploiting the local heat pump and thermal energy storage system at the ETS level, a simulation tool for the application of model predictive control (MPC) has been …",https://www.mdpi.com/1996-1073/13/17/4339,,0,"heat pump, thermal energy storage, model predictive control"
"Predictive control and coordination for energy community flexibility with electric vehicles, heat pumps and thermal energy storage",21,2023,… -based model predictive control (MPC) is developed for home energy management systems (… in cooperation with heat pump and thermal energy storages. The objective is to reduce …,https://www.sciencedirect.com/science/article/pii/S0306261923008644,,0,"heat pump, thermal energy storage, model predictive control"
Analysis of thermal energy storage tanks and PV panels combinations in different buildings controlled through model predictive control,18,2022,"… a heating system controlled by a model predictive control strategy, where the impact of different combinations of thermal energy storage … the coefficient of performance of the heat pump. …",https://www.sciencedirect.com/science/article/pii/S036054422102449X,,0,"heat pump, thermal energy storage, model predictive control"
Model predictive control for a university heat prosumer with data centre waste heat and thermal energy storage,12,2023,"… DH system to minimize the operation costs of the heat pump, which was used to charge the TES, by optimizing the charging schedule of the TES. The proposed MPC strategy was …",https://www.sciencedirect.com/science/article/pii/S0360544222034661,,0,"heat pump, thermal energy storage, model predictive control"
Experimental analysis of artificial intelligence-based model predictive control for thermal energy storage under different cooling load conditions,26,2022,… proposed a model predictive control (MPC) scheme using artificial intelligence (AI) to control the … The outdoor air temperature near the air-source heat pump chiller and the ambient air …,https://www.sciencedirect.com/science/article/pii/S2210670722000336,,0,"heat pump, thermal energy storage, model predictive control"
Evaluation of model predictive control (MPC) of solar thermal heating system with thermal energy storage for buildings with highly variable occupancy levels,7,2023,"… Simulation and experiment of a photovoltaic—air source heat pump system with thermal energy storage for heating and domestic hot water supply. Building Simulation, https://doi.org/…",https://link.springer.com/article/10.1007/s12273-023-1067-4,,0,"heat pump, thermal energy storage, model predictive control"
Assessing mixed-integer-based heat pump modeling approaches for model predictive control applications in buildings,9,2022,"… model and the real or simulation-based energy system. The MILP includes models of hot thermal energy storages (TESs), cold TESs (CTESs), boilers (BOI), solar thermal collectors (…",https://www.sciencedirect.com/science/article/pii/S0306261922011576,,0,"heat pump, thermal energy storage, model predictive control"
Optimization of operational strategy for ice thermal energy storage in a district cooling system based on model predictive control,17,2023,"… load prediction forms the foundation of TES system control optimization. Based on the cooling load prediction, a model predictive control (… the allocation of ice storage and regular chiller …",https://www.sciencedirect.com/science/article/pii/S2352152X23002694,,0,"heat pump, thermal energy storage, model predictive control"
Economic versus energetic model predictive control of a cold production plant with thermal energy storage,11,2022,… Economic model predictive control has been proposed as a means for solving the unit loading and unit allocation problem in multi-chiller cooling plants. The adjective economic stems …,https://www.sciencedirect.com/science/article/pii/S1359431122002678,,0,"heat pump, thermal energy storage, model predictive control"
Model predictive control for Demand-and Market-Responsive building energy management by leveraging active latent heat storage,25,2022,"… energy systems with cost-effective solutions (eg, active thermal energy storage (ATES) and smart control) … -efficient than the air source heat pump, is adopted to serve as the primary heat …",https://www.sciencedirect.com/science/article/pii/S0306261922013113,,0,"heat pump, thermal energy storage, model predictive control"
Model predictive control for the performance improvement of air source heat pump heating system via variable water temperature difference,14,2022,… An efficient-cost advanced control strategy is desired to improve the overall operating … a model predictive control (MPC) strategy for an air source heat pump (ASHP) heating system to …,https://www.sciencedirect.com/science/article/pii/S0140700722000548,,0,"heat pump, thermal energy storage, model predictive control"
Planning level sizing of heat pumps and hot water tanks incorporating model predictive control and future electricity tariffs,18,2022,"… : (i) model predictive control vs. fixed order control, (ii) existing and future wind-influenced electricity tariffs, and (iii) optimal cost size combinations of heat pump and hot water tank. The …",https://www.sciencedirect.com/science/article/pii/S0360544221019794,,0,"heat pump, thermal energy storage, model predictive control"
Model predictive control for a heat booster substation in ultra low temperature district heating systems,35,2022,"… a heat pump and a hot water tank for storage and flexible operation. This paper proposes a hybrid model predictive control strategy in which an existing heat … , a thermal energy storage (…",https://www.sciencedirect.com/science/article/pii/S036054422101879X,,0,"heat pump, thermal energy storage, model predictive control"
Dynamic Modeling and Flexibility Analysis of an Integrated Electrical and Thermal Energy System With the Heat Pump–Thermal Storage,12,2022,"… supply for end users, this article introduces the electric heat pump (HP) and thermal energy storage device (TES) on the basis of the existing IETEs so as to meet the new …",https://www.frontiersin.org/articles/10.3389/fenrg.2022.817503/full,,0,"heat pump, thermal energy storage, model predictive control"
Model predictive approaches for cost-efficient building climate control with seasonal energy storage,9,2022,"… On this basis, two Model Predictive Control (MPC) concepts … There are many suitable materials for thermal energy storage. … building, heat pump, and thermal energy storage and found …",https://www.sciencedirect.com/science/article/pii/S037877882200456X,,0,"heat pump, thermal energy storage, model predictive control"
Optimal control of a fourth generation district heating network using an integrated non-linear model predictive controller,12,2023,"… heat demand density, decarbonisation can be achieved by installing energy-efficient heat pumps … of both central and distributed heat sources, (seasonal) thermal energy storage (TES), …",https://www.sciencedirect.com/science/article/pii/S1359431123000595,,0,"heat pump, thermal energy storage, model predictive control"
Increasing electrical reserve provision in districts by exploiting energy flexibility of buildings with robust model predictive control,9,2023,"… control scheme based on robust Model Predictive Control … , where we exploit the thermal inertia of buffer storage tanks and a … , the heat pump is connected to a cold thermal storage tank, …",https://www.sciencedirect.com/science/article/pii/S2666792423000094,,0,"heat pump, thermal energy storage, model predictive control"
Operational optimisation of an air-source heat pump system with thermal energy storage for domestic applications,29,2022,"… % when optimising the heat pump operation. Similarly, in the work of Fischer [28], this proportion was shown to increase by more than 5 % using model predictive control. The objective …",https://www.sciencedirect.com/science/article/pii/S0196890422012043,,0,"heat pump, thermal energy storage, model predictive control"
Predictive control of low-temperature heating system with passive thermal mass energy storage and photovoltaic system: Impact of occupancy patterns and …,13,2023,"… advanced control strategies such as model predictive control … itself, named structural thermal energy storage (STES) in this … of a heat pump and PV system with thermal energy storage. …",https://www.sciencedirect.com/science/article/pii/S0360544223001858,,0,"heat pump, thermal energy storage, model predictive control"
Investigation of the effect of the envelope on building thermal storage performance under model predictive control by dynamic pricing,11,2022,"… Building thermal mass could store the thermal energy, ie structural thermal energy storage (STES), … After integrating thermal storage (ie, large heat pump in combined heat and power …",https://www.sciencedirect.com/science/article/pii/S2666955222000065,,0,"heat pump, thermal energy storage, model predictive control"
Thermal energy storage air-conditioning demand response control using elman neural network prediction model,36,2022,"… water pump still runs while the heat pump is closed, we should apply the energy storage duration model so … After that, the heat pump needs to be closed manually. In this way, when the …",https://www.sciencedirect.com/science/article/pii/S2210670721007472,,0,"heat pump, thermal energy storage, model predictive control"
