title,num_citations,year,excerpt,url,url_pdf,indicator,key_words
Model predictive control for a solar assisted ground source heat pump system,91,2018,"… (temperature difference with no changes in the phase) [5]. Other storage solutions exist such as borehole thermal energy storage, building mass, and phase change materials [6], …",https://www.sciencedirect.com/science/article/pii/S0360544218304882,,0,"heat pump, phase change material, model predictive control"
Hybrid model predictive control of a residential HVAC system with on-site thermal energy generation and storage,148,2017,… thermal (PVT) collector and a phase change material (PCM) thermal storage integrated with the air-handling unit (AHU) of a ducted reverse-cycle heat pump system. The simulation and …,https://www.sciencedirect.com/science/article/pii/S0306261916316269,,0,"heat pump, phase change material, model predictive control"
Performance of heat pump integrated phase change material thermal storage for electric load shifting in building demand side management,104,2019,… The model's prediction of total heat flow was therefore compared against experimental data from literature to show applicability to different climates. The experimental results from …,https://www.sciencedirect.com/science/article/pii/S0378778818333115,,0,"heat pump, phase change material, model predictive control"
Model predictive control for thermal energy storage and thermal comfort optimization of building demand response in smart grids,152,2019,"… A model predictive control (MPC) approach, with the features of shrunk prediction horizon, self-correction and simple parameter determination of embedded models, is therefore …",https://www.sciencedirect.com/science/article/pii/S0306261919304441,,0,"heat pump, phase change material, model predictive control"
Predictive rule-based control to activate the energy flexibility of Norwegian residential buildings: Case of an air-source heat pump and direct electric heating,109,2019,"… emissions, it should therefore be investigated whether model-predictive control could generate significant benefit even though the price and CO 2eq. signals have limited fluctuations in …",https://www.sciencedirect.com/science/article/pii/S0306261918318932,,0,"heat pump, phase change material, model predictive control"
Price-responsive model predictive control of floor heating systems for demand response using building thermal mass,126,2019,"… the discrete-time state-space model; u k is the input heating from inlet water to pipe plane at the time step k; COP is the coefficient of performance of the heat pump, which varies with the …",https://www.sciencedirect.com/science/article/pii/S1359431118361921,,0,"heat pump, phase change material, model predictive control"
An integrated model predictive control approach for optimal HVAC and energy storage operation in large-scale buildings,104,2019,"… HVAC system powered by heat pumps (HPs), a … , heat pumps, heater actuators, storage devices, and PV generation facilities are managed in an optimal fashion by a centralized control …",https://www.sciencedirect.com/science/article/pii/S030626191930162X,,0,"heat pump, phase change material, model predictive control"
Demand-response in building heating systems: A Model Predictive Control approach,193,2016,"… a centralized heating … heating devices, eg, electrical radiant floors or heat pumps. Assume that each zone is equipped with a temperature sensor connected to the centralized controller …",https://www.sciencedirect.com/science/article/pii/S0306261916300757,,0,"heat pump, phase change material, model predictive control"
Review of control strategies for improving the energy flexibility provided by heat pump systems in buildings,194,2019,"… heat pump is changed, according to the predefined strategy. On the other hand, Model Predictive Control … Many other types of thermal storage do exist, such as Phase Change Materials …",https://www.sciencedirect.com/science/article/pii/S0959152418300489,,0,"heat pump, phase change material, model predictive control"
"Model predictive control of heating, ventilation, and air conditioning (HVAC) systems: A state-of-the-art review",105,2022,… is compared to a data-driven MPC utilizing a single heat pump air conditioning system placed in a school lab. MPC based on learning lowered energy usage by 25%–65% when …,https://www.sciencedirect.com/science/article/pii/S2352710222010750,,0,"heat pump, phase change material, model predictive control"
Model-based predictive control of an ice storage device in a building cooling system,149,2013,"… ) systems, control techniques based on modelling, prediction and … Although the specific wording “model predictive control” has … Performance tables of heat pumps are typically presented …",https://www.sciencedirect.com/science/article/pii/S0306261913005047,,0,"heat pump, phase change material, model predictive control"
Nonlinear model predictive control for thermal management in plug-in hybrid electric vehicles,101,2016,"… as nonlinear model predictive control (NMPC). Through the combination of the model and the … in advanced vehicles using phase change materials,” World Elect. Vehicle J., vol. 2, no. …",https://ieeexplore.ieee.org/abstract/document/7529090/,,0,"heat pump, phase change material, model predictive control"
"Model predictive control (MPC) for enhancing building and HVAC system energy efficiency: Problem formulation, applications and opportunities",595,2018,"… (eg, minimum or maximum power of a heat pump [112] or a terminal unit [104], … of change of their operation (eg, boiler or heat pump response rate [112], valve/damper/pump/fan change …",https://www.mdpi.com/1996-1073/11/3/631,,0,"heat pump, phase change material, model predictive control"
Economic model predictive control for demand flexibility of a residential building,115,2019,"… These can be combined with thermal energy storage (TES) options such as building thermal mass, water tanks, phase-change materials, or thermochemical storage systems [5,15]. …",https://www.sciencedirect.com/science/article/pii/S0360544219305912,,0,"heat pump, phase change material, model predictive control"
State of the art review on model predictive control (MPC) in Heating Ventilation and Air-conditioning (HVAC) field,253,2021,… Model predictive control (MPC) has been one of the potential strategies for control schemes to address these problems and tackle them since its invention. MPC is a suitable and the …,https://www.sciencedirect.com/science/article/pii/S0360132321003565,,0,"heat pump, phase change material, model predictive control"
Ten questions concerning model predictive control for energy efficient buildings,391,2016,"… For heating, solar heat as well as heat pumps may be operated together with district heating or … photovoltaic thermal energy generation and phase change material thermal storage [66]. …",https://www.sciencedirect.com/science/article/pii/S0360132316301925,,0,"heat pump, phase change material, model predictive control"
Handling model uncertainty in model predictive control for energy efficient buildings,283,2014,"… -adaptive building (PAB) model. Second, we propose a robust model predictive control (RMPC) formulation to make a building controller robust to model uncertainties. The results from …",https://www.sciencedirect.com/science/article/pii/S0378778814002771,,0,"heat pump, phase change material, model predictive control"
An optimisation framework for thermal energy storage integration in a residential heat pump heating system,194,2017,… heating system is essential and an option to achieve this is by heating system electrification through heat pumps (… and building fabric characteristics on heat pump annual performance …,https://www.sciencedirect.com/science/article/pii/S0306261916302045,,0,"heat pump, phase change material, model predictive control"
Quantifying demand flexibility of power-to-heat and thermal energy storage in the control of building heating systems,226,2018,"… of an office building equipped with heat pump, electric heater, … phase change material tank, and a thermochemical material … Predictive and non-predictive controls were compared and it …",https://www.sciencedirect.com/science/article/pii/S0306261917316112,,0,"heat pump, phase change material, model predictive control"
Model predictive control with adaptive machine-learning-based model for building energy efficiency and comfort optimization,242,2020,… to control the ground source heat pump and the MPC system achieved 53.5% reduction of the heat pump … with greatly improved thermal comfort as compared to a rule-based controller. …,https://www.sciencedirect.com/science/article/pii/S0306261920306590,,0,"heat pump, phase change material, model predictive control"
Economic model predictive control of combined thermal and electric residential building energy systems,121,2019,"… model predictive control of complex residential energy systems … The examined system includes a battery energy storage … -water heat pump, thermal energy storage and a building model…",https://www.sciencedirect.com/science/article/pii/S0306261919300996,,0,"heat pump, thermal energy storage, model predictive control"
Model predictive control of central chiller plant with thermal energy storage via dynamic programming and mixed-integer linear programming,123,2014,… systems can help realize the full potential of both energy and cost savings for … control using a model predictive control (MPC) scheme. The main idea of MPC is to use the system model …,https://ieeexplore.ieee.org/abstract/document/6899700/,,0,"heat pump, thermal energy storage, model predictive control"
Model predictive control of domestic heat pump,52,2013,"… water heat pump, thermal energy from the ground is used to heat … the evaporator where thermal energy is transferred from the … , “Using heat pump energy storages in the power grid,” in …",https://ieeexplore.ieee.org/abstract/document/6580131/,,0,"heat pump, thermal energy storage, model predictive control"
"… identification and model-predictive control of office buildings with integrated photovoltaic-thermal collectors, radiant floor heating and active thermal storage",129,2015,… saving potential of the integrated system and the predictive controller in … heat pump and a thermal energy storage (TES) tank that serves as the heat source for the radiant floor heating (…,https://www.sciencedirect.com/science/article/pii/S0038092X14005684,,0,"heat pump, thermal energy storage, model predictive control"
Cost-optimal thermal energy storage system for a residential building with heat pump heating and demand response control,162,2016,"… thermal energy storage system coupled with a ground source heat pump (GSHP) and developed DR control … In the case of the predictive control algorithm, energy cost can be slightly …",https://www.sciencedirect.com/science/article/pii/S0306261916304640,,0,"heat pump, thermal energy storage, model predictive control"
Model predictive control of heat pump water heater-instantaneous shower powered with integrated renewable-grid energy systems,75,2017,… open loop optimal control model by using the closed-loop model predictive control (MPC) to … but also the ability to use the energy stored in the battery in case of either power black out or …,https://www.sciencedirect.com/science/article/pii/S0306261917305342,,0,"heat pump, thermal energy storage, model predictive control"
Reduction of heat pump induced peak electricity use and required generation capacity through thermal energy storage and demand response,182,2017,… loads on the electricity grid. Extra flexibility can be added in the form of a thermal energy storage tank. This paper proposes a multi-objective model predictive control strategy for such a …,https://www.sciencedirect.com/science/article/pii/S0306261917302854,,0,"heat pump, thermal energy storage, model predictive control"
Model predictive control strategy applied to different types of building for space heating,85,2021,"… was able to satisfy the cooling demand of the room with a higher heat pump average coefficient of performance than the reference standard air conditioner. To the authors’ knowledge, …",https://www.taylorfrancis.com/chapters/edit/10.1201/9780367567699-25/model-predictive-control-strategy-applied-different-types-building-space-heating-gohar-gholamibozanjani-joan-tarragona-alvaro-de-gracia-c%C3%A8sar-fern%C3%A1ndez-luisa-cabeza-mohammed-farid,,0,"heat pump, thermal energy storage, model predictive control"
Model predictive control of commercial buildings in demand response programs in the presence of thermal storage,62,2019,"… incentivize signals for the participation of thermal energy storage (TES) integrated commercial … In this regard, a model predictive control (MPC) strategy has been developed to optimize …",https://www.sciencedirect.com/science/article/pii/S0959652619302914,,0,"heat pump, thermal energy storage, model predictive control"
"A predictive control strategy for optimal management of peak load, thermal comfort, energy storage and renewables in multi-zone buildings",106,2019,"… building thermal mass, and schedules residential heat pump … by developing a model predictive control framework that (i) … thermal comfort, and (ii) coordinates HVAC, battery energy …",https://www.sciencedirect.com/science/article/pii/S2352710219302165,,0,"heat pump, thermal energy storage, model predictive control"
Management of hybrid energy supply systems in buildings using mixed-integer model predictive control,79,2015,"… storage tank and a switched heat pump with minimum on/off times. The mixed-integer model predictive controller … That is why appropriate thermal energy storages become necessary, [2]…",https://www.sciencedirect.com/science/article/pii/S0196890415001971,,0,"heat pump, thermal energy storage, model predictive control"
Model predictive control based robust scheduling of community integrated energy system with operational flexibility,100,2019,… an optimization model to achieve the potential increase in performance and flexibility by coordinating the operation of heat pumps and thermal energy storage of a heating system. And …,https://www.sciencedirect.com/science/article/pii/S0306261919306257,,0,"heat pump, thermal energy storage, model predictive control"
Real time optimal control of district cooling system with thermal energy storage using neural networks,123,2019,… to changes in electricity prices in real time. This study considers a model predictive controller (MPC) to minimize operating costs for a large district cooling system with ice storage. The …,https://www.sciencedirect.com/science/article/pii/S0306261919300911,,0,"heat pump, thermal energy storage, model predictive control"
"Mapping the energy flexibility potential of single buildings equipped with optimally-controlled heat pump, gas boilers and thermal storage",76,2019,"… thermal energy storage … heat pump cannot meet the required thermal output, the boiler supplies the residual load demand. Both generators are controlled by a model predictive control (…",https://www.sciencedirect.com/science/article/pii/S2210670718326787,,0,"heat pump, thermal energy storage, model predictive control"
Model predictive control for central plant optimization with thermal energy storage,15,2014,"… energy plant including heat pump chillers, conventional chillers, water heaters, and hot and cold water (thermal energy) storage. … to both real-time energy prices and demand charges. A …",https://docs.lib.purdue.edu/ihpbc/122/,,0,"heat pump, thermal energy storage, model predictive control"
Model predictive control of heat pump water heaters for energy efficiency,37,2014,"… a model predictive control (MPC) framework that aims to achieve maximum energy savings while maintaining thermal … of node i, and denotes the rate of change in thermal energy. …",https://www.researchgate.net/profile/Xin-Jin-94/publication/267026958_Model_Predictive_Control_of_Heat_Pump_Water_Heaters_for_Energy_Efficiency/links/54414a010cf2a76a3cc7d7a6/Model-Predictive-Control-of-Heat-Pump-Water-Heaters-for-Energy-Efficiency.pdf,http://scholar.google.com/https://www.researchgate.net/profile/Xin-Jin-94/publication/267026958_Model_Predictive_Control_of_Heat_Pump_Water_Heaters_for_Energy_Efficiency/links/54414a010cf2a76a3cc7d7a6/Model-Predictive-Control-of-Heat-Pump-Water-Heaters-for-Energy-Efficiency.pdf,0,"heat pump, thermal energy storage, model predictive control"
Building demand-side control using thermal energy storage under uncertainty: An adaptive Multiple Model-based Predictive Control (MMPC) approach,41,2013,… control measures should be placed proactively in a harmonized fashion. Mechanical thermal energy storage (… technical instrument of the demand-side control that can be selected for an …,https://www.sciencedirect.com/science/article/pii/S0360132313001443,,0,"heat pump, thermal energy storage, model predictive control"
Hybrid model predictive control of stratified thermal storages in buildings,34,2014,"… model predictive control (MPC) algorithm for the management of stratified thermal storage tanks … of the building's heat/cold generation, consumption and consumption control. The main …",https://www.sciencedirect.com/science/article/pii/S0378778814005921,,0,"heat pump, thermal energy storage, model predictive control"
Hybrid model predictive control of a residential HVAC system with PVT energy generation and PCM thermal storage,51,2015,"… ducted reverse-cycle heat pump system. The system was … electricity and low grade thermal energy, and the PCM store … have on-site renewable energy generation, energy storage and/or …",https://www.sciencedirect.com/science/article/pii/S187661021502857X,,0,"heat pump, thermal energy storage, model predictive control"
Central model predictive control of a group of domestic heat pumps case study for a small district,11,2015,… that a model predictive control outperforms conventional control of individual heat pumps based on feedback control … The ability of the floor heating to store thermal energy and possible …,https://ieeexplore.ieee.org/abstract/document/7297969/,,0,"heat pump, thermal energy storage, model predictive control"
Comparison of models for thermal energy storage units and heat pumps in mixed integer linear programming,28,2015,"… Typically, the models for heat pumps and thermal energy storage … TES units for example are usually modeled as thermal capacities … models can be incorporated into a model predictive …",https://www.researchgate.net/profile/Thomas-Schuetz/publication/279916800_Comparison_of_models_for_thermal_energy_storage_units_and_heat_pumps_in_mixed_integer_linear_programming/links/559e1f0a08ae04e3650916dc/Comparison-of-models-for-thermal-energy-storage-units-and-heat-pumps-in-mixed-integer-linear-programming.pdf,http://scholar.google.com/https://www.researchgate.net/profile/Thomas-Schuetz/publication/279916800_Comparison_of_models_for_thermal_energy_storage_units_and_heat_pumps_in_mixed_integer_linear_programming/links/559e1f0a08ae04e3650916dc/Comparison-of-models-for-thermal-energy-storage-units-and-heat-pumps-in-mixed-integer-linear-programming.pdf,0,"heat pump, thermal energy storage, model predictive control"
Investigation of thermal storage operation strategies with heat pumps in German multi family houses,52,2014,"… applications of heat pumps in households connected to a thermal storage are … Model predictive control of thermal energy storage in building cooling systems,” Decision and Control…",https://www.sciencedirect.com/science/article/pii/S1876610214017871,,0,"heat pump, thermal energy storage, model predictive control"
Smart grid energy flexible buildings through the use of heat pumps and building thermal mass as energy storage in the Belgian context,159,2015,"… energy cost reduction through load shifting and peak shaving. Embedded model predictive control … Q HP,floor represents the share of thermal energy provided by the heat production …",https://www.tandfonline.com/doi/abs/10.1080/23744731.2015.1035590,,0,"heat pump, thermal energy storage, model predictive control"
Hybrid model predictive control for optimal energy management of a smart house,22,2015,"… model, we derive a hybrid model predictive control (MPC) strategy. The controller is able to track the desired temperature … the energy stored in the battery for the day, when the price of …",https://ieeexplore.ieee.org/abstract/document/7165215/,,0,"heat pump, thermal energy storage, model predictive control"
A novel linear predictive control approach for auxiliary energy supply to a solar thermal combistorage,32,2014,… model predictive approach to control the auxiliary heating for … energy supply has to “compete against” the auxiliary energy … or auxiliary energy supply into a thermal energy storage (TES…,https://www.sciencedirect.com/science/article/pii/S0038092X1300532X,,0,"heat pump, thermal energy storage, model predictive control"
Performance analysis of hybrid ground source heat pump systems based on ANN predictive control,111,2014,… systems and the energy storage buffer to make full use of the renewable … of the predictive control strategy for the HGSHP system and compare it with conventional control strategies. A …,https://www.sciencedirect.com/science/article/pii/S0306261914003389,,0,"heat pump, thermal energy storage, model predictive control"
A study on the energy management in domestic micro-grids based on model predictive control strategies,126,2015,"… HPS including both short term and seasonal energy storage, with the main target of … heat pump and three internal heat exchangers. The internal temperature of the house is controlled …",https://www.sciencedirect.com/science/article/pii/S0196890415000801,,0,"heat pump, thermal energy storage, model predictive control"
Recent research and applications of ground source heat pump integrated with thermal energy storage systems: A review,155,2014,… on the types of heat pumps especially used for GSHP and their efficiency. Sanner et al. [3] studied the current status of GSHPs and underground thermal energy storage (UTES) in …,https://www.sciencedirect.com/science/article/pii/S1359431114005201,,0,"heat pump, thermal energy storage, model predictive control"
Model predictive control for energy efficient cooling and dehumidification,27,2013,"… active thermal energy storage, annual cooling system energy … the outside temperature is lower than the water temperature. … heat pumps were used in the model predictive control by …",https://dspace.mit.edu/handle/1721.1/82161,,0,"heat pump, thermal energy storage, model predictive control"
Data-driven modeling of thermal energy storage tank,10,2014,"… tank coupled with radiant floor heating (RFH) and ground source heat pump (… controllers (such as, a PID or a model predictive controller) for precise control of buffer tank temperature. …",https://ieeexplore.ieee.org/abstract/document/6901009/,,0,"heat pump, thermal energy storage, model predictive control"
Formulation of a model predictive control algorithm to enhance the performance of a latent heat solar thermal system,51,2018,"… by different auxiliary heat sources (eg a natural gas boiler, electric heat pump, combined … In the present paper, a lumped thermal model of the thermal energy storage was also …",https://www.sciencedirect.com/science/article/pii/S0196890418308409,,0,"heat pump, thermal energy storage, model predictive control"
A predictive control strategy for energy management in buildings with radiant floors and thermal storage,21,2018,"… heat pumps as effective devices to provide heating in buildings, and exploiting thermal energy storage (… A model predictive controller is also part of the solution, with the goal to manage …",https://ieeexplore.ieee.org/abstract/document/8330158/,,0,"heat pump, thermal energy storage, model predictive control"
Operational optimisation of a heat pump system with sensible thermal energy storage using genetic algorithm,16,2018,… -based control approaches could offer. Commonly used model predictive control approaches … -predictive control strategies. Increasing levels of detail range from black-box to white-box …,https://doiserbia.nb.rs/Article.aspx?id=0354-98361800272S,,0,"heat pump, thermal energy storage, model predictive control"
A model predictive control approach for demand side management of residential power to heat technologies,20,2016,"… of various types of energy storages, which … model predictive controller developed in this paper is based on the validated house model in [16] which was adapted to a heat pump heating …",https://ieeexplore.ieee.org/abstract/document/7513903/,,0,"heat pump, thermal energy storage, model predictive control"
Optimal energy management of a small-size building via hybrid model predictive control,69,2017,"… of a Model Predictive Control (MPC) scheme to optimally manage the thermal and electrical … expense for buying energy from the grid, while keeping the room temperature within given …",https://www.sciencedirect.com/science/article/pii/S0378778817301652,,0,"heat pump, thermal energy storage, model predictive control"
A novel hybrid agent-based model predictive control for advanced building energy systems,40,2018,"… for the exergy analysis of thermal energy flows in buildings. … power generation units with electrical energy storage systems to … heat pump, if the hot forward flow temperature of the energy …",https://www.sciencedirect.com/science/article/pii/S0196890418309956,,0,"heat pump, thermal energy storage, model predictive control"
